{
  "schema_version": "3.0",
  "document": "Abbildung v2.0 → v3.0",
  "as_of": "2026-09-24",
  "rule": "Jede Übernahme ist im Text mit „übernommen aus v2.0“ markiert und hier einem Konzept zugeordnet (§3.2); jede v2-Datei hat einen Verbleib.",
  "source": "SRC-V2-PAKET",
  "adoptions": [
    {
      "id": "C01",
      "concept": "Persistenz vor jedem Netzwerkaufruf",
      "adaptation": "SQLite WAL mit synchronous=FULL; unverändert",
      "locations": [
        "architecture/state_machines.json",
        "execution/oms_ems.md"
      ]
    },
    {
      "id": "C02",
      "concept": "UNKNOWN statt Raten mit Negativnachweis",
      "adaptation": "Negativnachweis über ORDER_TIME_SPECIFIED und P-EXE-NEGPROOF-CYCLES (MT5)",
      "locations": [
        "execution/oms_ems.md"
      ]
    },
    {
      "id": "C03",
      "concept": "Einstiege genau einmal",
      "adaptation": "unverändert",
      "locations": [
        "architecture/interfaces.md"
      ]
    },
    {
      "id": "C04",
      "concept": "Deduplizierung von Ausführungen",
      "adaptation": "Deal-Ticket statt Ausführungs-ID (MT5)",
      "locations": [
        "execution/oms_ems.md"
      ]
    },
    {
      "id": "C05",
      "concept": "Genau ein Writer mit Fencing",
      "adaptation": "Fencing über Wechsel des Hauptpassworts (KT-16)",
      "locations": [
        "Masterkonzept_v3.0.md",
        "architecture/state_machines.json",
        "execution/oms_ems.md"
      ]
    },
    {
      "id": "C06",
      "concept": "Sperrgrund-Verband mit Schutzbasis",
      "adaptation": "neue Gründe für Leitern, Kill-Switch, Modus, Margin",
      "locations": [
        "architecture/state_machines.json"
      ]
    },
    {
      "id": "C07",
      "concept": "Signierte, befristete Grants und Betreiberaktionen",
      "adaptation": "Kontotyp und Profil im Grant; BQ-09",
      "locations": [
        "architecture/interfaces.md",
        "architecture/state_machines.json",
        "governance/grants_and_risk_acceptance.md"
      ]
    },
    {
      "id": "C08",
      "concept": "Getrennter Evaluator mit signierten Torergebnissen",
      "adaptation": "Tore G0–G10",
      "locations": [
        "architecture/state_machines.json",
        "architecture/system_design.md",
        "execution/pretrade_controls.md"
      ]
    },
    {
      "id": "C09",
      "concept": "LLM-Gateway und Projektschnittstelle",
      "adaptation": "Allowlist mit vierzehn Werkzeugen",
      "locations": [
        "architecture/interfaces.md"
      ]
    },
    {
      "id": "C10",
      "concept": "Unitisierter NAV mit verriegelten Verlusthalts",
      "adaptation": "Leitern nach risk/limits.md",
      "locations": [
        "implementation/test_catalog.json",
        "requirements.json"
      ]
    },
    {
      "id": "C11",
      "concept": "Register-, Render- und Validator-Technik mit Mutationstests",
      "adaptation": "neu geschrieben, Technik gleich",
      "locations": [
        "validation/gate_engine.py",
        "validation/render_blocks.py",
        "validation/state_engine.py"
      ]
    },
    {
      "id": "C12",
      "concept": "Register externer Eingaben mit Sperrwirkung",
      "adaptation": "34 Eingaben",
      "locations": [
        "Masterkonzept_v3.0.md"
      ]
    },
    {
      "id": "C13",
      "concept": "Holdout-Versiegelung",
      "adaptation": "im Prüfmodul, einmalige Öffnung in G4",
      "locations": [
        "Masterkonzept_v3.0.md",
        "architecture/state_machines.json",
        "data/data_plan.md",
        "research/evidence_gates.json",
        "research/research_plan.md"
      ]
    },
    {
      "id": "C14",
      "concept": "Betriebscharakteristik der Tore",
      "adaptation": "mit Futility-Regel (EV-05)",
      "locations": [
        "research/research_plan.md"
      ]
    },
    {
      "id": "C15",
      "concept": "Autonomieleiter und Governance des Agenten über Dateisystem und Netz",
      "adaptation": "gegen die gepinnte Hermes-Version zu prüfen",
      "locations": [
        "ai/ai_layer.md",
        "ai/hermes_integration.md"
      ]
    },
    {
      "id": "C16",
      "concept": "Evaluationssuite des Agenten",
      "adaptation": "P-AI-EVAL-*",
      "locations": [
        "ai/eval_suite_spec.md"
      ]
    },
    {
      "id": "C17",
      "concept": "Autoritative Quellen je Zustand",
      "adaptation": "Broker autoritativ für Bestände",
      "locations": [
        "architecture/system_design.md"
      ]
    },
    {
      "id": "C18",
      "concept": "Zwei Alarmwege mit täglichem Testalarm",
      "adaptation": "P-OPS-ALERT-ACK-H",
      "locations": [
        "architecture/system_design.md"
      ]
    },
    {
      "id": "C19",
      "concept": "Änderungsklassen mit Karenzzeit",
      "adaptation": "verschärft um die menschliche zweite Freigabe",
      "locations": [
        "governance/policies/change_policy.md",
        "security/key_management.md"
      ]
    },
    {
      "id": "C20",
      "concept": "Schlüsselhinterlegung und Break-glass",
      "adaptation": "Hardware-Schlüssel",
      "locations": [
        "security/key_management.md"
      ]
    },
    {
      "id": "C21",
      "concept": "Nachführung nur enger",
      "adaptation": "SL der Position (TRADE_ACTION_SLTP)",
      "locations": [
        "architecture/state_machines.json",
        "execution/oms_ems.md"
      ]
    },
    {
      "id": "C22",
      "concept": "Zustandsautomaten mit Traces",
      "adaptation": "auf MT5 und Mehrstrategiebetrieb angepasst; neu SM-LEVERAGE, SM-MLMODEL",
      "locations": [
        "Masterkonzept_v3.0.md",
        "architecture/state_machines.json"
      ]
    },
    {
      "id": "C23",
      "concept": "Notfalljournal und Fail-Stop",
      "adaptation": "unverändert",
      "locations": [
        "execution/oms_ems.md"
      ]
    },
    {
      "id": "C24",
      "concept": "Leckageprüfung durch Verschieben der Daten",
      "adaptation": "Voraussetzung von G2",
      "locations": [
        "data/data_plan.md"
      ]
    },
    {
      "id": "C25",
      "concept": "Notfallprioritäten",
      "adaptation": "Schutz > keine Exposure > Alarm > Abgleich > Agent",
      "locations": [
        "operations/operations_plan.md"
      ]
    },
    {
      "id": "C26",
      "concept": "Technische Grenzen des Systems",
      "adaptation": "keine Gelder Dritter, Marktverhaltenskontrollen",
      "locations": [
        "Masterkonzept_v3.0.md"
      ]
    },
    {
      "id": "C27",
      "concept": "Szenarien S01–S21 und N01–N18",
      "adaptation": "architecture/scenario_catalog.json",
      "locations": [
        "architecture/scenario_catalog.json",
        "architecture/system_design.md"
      ]
    },
    {
      "id": "C28",
      "concept": "Parameterwerte mit v2-Herkunft",
      "adaptation": "je Parameter im Feld basis vermerkt",
      "locations": [
        "parameters.json"
      ],
      "parameters": [
        "P-STR-BASE-ENTRY-N",
        "P-STR-BASE-EXIT-N",
        "P-STR-BASE-ATR-N",
        "P-STR-BASE-STOP-ATR",
        "P-RES-HOLDOUT-YEARS",
        "P-EXE-SNAPSHOT-MAX-S",
        "P-EXE-RECON-ACTIVE-S",
        "P-EXE-RECON-IDLE-S",
        "P-EXE-UNKNOWN-POLL-S",
        "P-EXE-UNKNOWN-POLL-LATER-S",
        "P-EXE-UNKNOWN-MAX-H",
        "P-EXE-STOP-CONFIRM-S",
        "P-EXE-LEASE-S",
        "P-EXE-NEGPROOF-CYCLES",
        "P-QA-FAULT-REPEATS",
        "P-OPS-HEARTBEAT-S",
        "P-OPS-HEARTBEAT-CRIT-S",
        "P-OPS-RESTART-MAX-N",
        "P-OPS-RESTART-WINDOW-MIN",
        "P-OPS-RESTART-S",
        "P-OPS-RPO-JOURNAL-MIN",
        "P-OPS-RTO-CORE-H",
        "P-OPS-BACKUP-DAILY",
        "P-OPS-BACKUP-WEEKLY",
        "P-OPS-RESTORE-DRILL-D",
        "P-OPS-CLOCK-WARN-S",
        "P-OPS-CLOCK-BLOCK-S",
        "P-OPS-DISK-LEVELS",
        "P-OPS-ALERT-ACK-H",
        "P-OPS-ALERT-DOWN-H",
        "P-OPS-PRESENCE-MAX-D",
        "P-OPS-ISOLATE-MIN",
        "P-OPS-CHANGE-COOLDOWN-H",
        "P-SEC-SIG-EXPIRY-MIN",
        "P-SEC-GRANT-DAYS",
        "P-SEC-INJECTION-CASES",
        "P-SEC-PATCH-CRIT-D",
        "P-AI-EVAL-CASES",
        "P-AI-EVAL-HIDDEN",
        "P-AI-EVAL-ROTATE",
        "P-AI-EVAL-REPEATS",
        "P-AI-ACCEPT-MIN",
        "P-AI-JOB-MAX-H",
        "P-AI-PROPOSALS-OPEN-MAX",
        "P-AI-PROPOSALS-WEEK-MAX",
        "P-AI-PAYLOAD-MAX-MIB",
        "P-AI-WORK-BUDGET-H",
        "P-AI-REVIEW-ROUNDS"
      ]
    },
    {
      "id": "C29",
      "concept": "Quellen aus v2.0 (erneut geprüft)",
      "adaptation": "je Quelle im Feld origin vermerkt; Status neu bewertet",
      "locations": [
        "registers/source_register.json"
      ],
      "sources": [
        "SRC-BAFIN-AV-CFD",
        "SRC-BAFIN-EIGENGESCHAEFT",
        "SRC-BBK-MFI",
        "SRC-CBOT-MTN",
        "SRC-ECB-ESTR",
        "SRC-ECB-FXREF",
        "SRC-ECB-RATES",
        "SRC-ESMA-CFD-2026",
        "SRC-HERMES-CONFIG",
        "SRC-HERMES-EGRESS",
        "SRC-HERMES-ISSUE-34514",
        "SRC-HERMES-MCP",
        "SRC-HERMES-MEMORY",
        "SRC-HERMES-SECURITY",
        "SRC-HERMES-UPDATE",
        "SRC-LIT-KAMINSKI-WEN-2025",
        "SRC-LIT-LO-2002",
        "SRC-MT5-PYPI",
        "SRC-RHEINMETALL-DAX",
        "SRC-SG-TREND-TTU-2025",
        "SRC-SP500-HOLDINGS",
        "SRC-SQLITE-WAL",
        "SRC-WB-PINKSHEET"
      ]
    },
    {
      "id": "C30",
      "concept": "Harm- und Futility-Monitor im Betrieb",
      "adaptation": "MON-HARM mit P-MON-HARM-SR und P-RES-FUTILITY",
      "locations": [
        "research/evidence_gates.json"
      ]
    },
    {
      "id": "C31",
      "concept": "Kein Sprachmodell im Geldpfad (D3-05)",
      "adaptation": "technisch erzwungen; Tests T-AI-001 bis T-AI-004",
      "locations": [
        "registers/decision_register.json"
      ]
    },
    {
      "id": "C32",
      "concept": "Evidenztore als geordnete Regeltabellen",
      "adaptation": "Tore G0–G10 und Monitore; ein Folgeschritt je Ergebnis",
      "locations": [